{
  "schema_version": "1.0.0",
  "proposal_id": "prop-pilot-001",
  "reviewer_id": "srl-independent-reviewer-agent",
  "implementer_id": "srl-implementer-agent",
  "independent_from_implementer": true,
  "contract_alignment": "PASS",
  "allowed_path_compliance": "PASS",
  "acceptance_results": "PASS",
  "security_findings": [],
  "architecture_findings": [
    "Change stays within docs/tests autonomous lane"
  ],
  "verdict": "PASS",
  "repair_instructions": []
}
